{
  "$schema": "http://json-schema.org/draft-07/schema#",
  "title": "Shopping Short Beat Sheet",
  "description": "The data contract for one short. Skeleton fields are reusable; vo_monologue, beats[].vo_line and beats[].caption are regenerated per product in US English.",
  "type": "object",
  "required": ["product", "persona", "hook_type", "total_duration", "vo_monologue", "beats", "cta"],
  "properties": {
    "product": {
      "type": "string",
      "description": "Product name / SKU being featured."
    },
    "persona": {
      "type": "string",
      "description": "Key from data/personas.yaml. Required. 'enthusiastic creator' is not allowed.",
      "enum": ["skeptic_won_over", "tired_parent", "broke_foodie", "lazy_genius"]
    },
    "hook_type": {
      "type": "string",
      "description": "Named hook archetype carried from the teardown.",
      "examples": ["curiosity", "disbelief", "price-shock", "problem-solution", "before-after"]
    },
    "total_duration": {
      "type": "number",
      "description": "Total seconds."
    },
    "pacing": {
      "type": "string",
      "description": "Pacing rule from the skeleton, e.g. '1-1.5s cuts, full process compressed to 10s'."
    },
    "vo_monologue": {
      "type": "string",
      "description": "The full-duration VO written as ONE continuous monologue in the chosen persona, BEFORE splitting to beats. This field must be authored first."
    },
    "beats": {
      "type": "array",
      "minItems": 1,
      "items": {
        "type": "object",
        "required": ["start", "end", "caption", "vo_line", "sealcam"],
        "properties": {
          "start": { "type": "number" },
          "end": { "type": "number" },
          "caption": {
            "type": "string",
            "description": "On-screen title — the CLAIM/spec. Compressed fragment. Must NOT equal the vo_line."
          },
          "vo_line": {
            "type": "string",
            "description": "Slice of the continuous monologue for this beat. Must REACT, not narrate the caption."
          },
          "sealcam": {
            "type": "object",
            "description": "Shot spec for the imagery engine (Higgsfield).",
            "required": ["subject", "environment", "action", "lighting", "camera", "sound"],
            "properties": {
              "subject": { "type": "string" },
              "environment": { "type": "string" },
              "action": { "type": "string" },
              "lighting": { "type": "string" },
              "camera": { "type": "string" },
              "sound": { "type": "string" }
            }
          },
          "transition": {
            "type": "string",
            "description": "Transition into the next beat (for the Remotion assembler)."
          }
        }
      }
    },
    "cta": {
      "type": "object",
      "required": ["caption", "vo_line", "mechanic", "disclosure"],
      "properties": {
        "caption": { "type": "string", "description": "Short CTA caption, e.g. 'Comment NEED IT'." },
        "vo_line": { "type": "string", "description": "Casual spoken close, not salesy." },
        "mechanic": { "type": "string", "description": "Funnel mechanic, e.g. 'comment keyword -> DM link'." },
        "disclosure": { "type": "string", "description": "FTC/Associates disclosure text. Literal, exempt from persona/ban-list." }
      }
    }
  }
}
